"Name","Website"
"コネクシオ株式会社",""
"日本国土開発株式会社",""
"積水ハウス・アセットマネジメント株式会社",""
"株式会社ヨコハウス",""
"株式会社 フジセキュリティ",""
"株式会社サーティーフォー",""
"埼玉建興株式会社",""
"パナソニック ホールディングス株式会社",""
"株式会社大方工業所",""
"株式会社若月木工所",""
"リョービ株式会社",""
"仙建工業株式会社",""
"株式会社 ベイシア",""
"株式会社ミカミ",""
"株式会社エイコー",""
"YKアクロス株式会社",""
"理研軽金属工業株式会社",""
"トゥインクルワールド 株式会社",""
"株式会社穴吹工務店",""
"一般社団法人 日本塗料工業会",""
"ジェイアール東海商事株式会社",""
"日鉄興和不動産株式会社",""
"株式会社JSP",""
"DIC株式会社",""
"株式会社 福田組",""
"キヤノンマーケティングジャパン株式会社",""
"PIC株式会社",""
"ESRIジャパン株式会社",""
"株式会社DAN都市デザイン",""
"カネカソーラー販売株式会社",""
"ゼビオコーポレート株式会社",""
"日清紡ブレーキ株式会社",""
"株式会社グリーンクロスホールディングス",""
"富士通Japan 株式会社",""
"株式会社創建",""
"鹿島建設株式会社",""
"清水総合開発株式会社",""
"富士通株式会社",""
"ヤマハサウンドシステム株式会社",""
"株式会社アーキエムズグループ",""
"大和ハウス工業株式会社",""
"大成建設ハウジング株式会社",""
"NECファシリティーズ株式会社",""
"株式会社ライフ",""
"株式会社プレイド",""
"菊水化学工業株式会社",""
"日鉄鋼板 株式会社",""
"株式会社 トヨタエンタプライズ",""
"笹徳印刷株式会社",""
"株式会社JSOL",""
"藤田電気工事株式会社",""
"シューコー・ジャパン株式会社",""
"株式会社 若松組",""
"パナソニックEWエンジニアリング株式会社",""
"NTTファシリティーズ",""
"株式会社OUGIYA",""
"株式会社コムラエージェンシー",""
"独立行政法人 都市再生機構",""
"株式会社LIFEFUND",""
"OMデジタルソリューションズ株式会社",""
"堺アルミ株式会社",""
"パシフィックシステム株式会社",""
"コイズミ照明株式会社",""
"株式会社UACJ",""
"大日本土木株式会社",""
"西日本旅客鉄道株式会社",""
"株式会社早川電工",""
"NTTドコモビジネス株式会社",""
"郡リース 株式会社",""
"YKK AP株式会社",""
"株式会社NTTデータ先端技術",""
"米澤労働安全コンサルタント事務所",""
"JFE東日本ジーエス株式会社",""
"株式会社ゴーレム",""
"リコージャパン株式会社",""
"有限会社 大栄工業",""
"FSテクニカル株式会社",""
"株式会社INA新建築研究所",""
"サンテレホン株式会社",""
"高島屋スペースクリエイツ株式会社",""
"海上自衛隊",""
"(地独)北海道立総合研究機構",""
"株式会社パシフィック・デザイン・システムズ",""
"株式会社NBSロジソル",""
"株式会社HAGS",""
"日本郵政不動産株式会社",""
"兼松サステック株式会社",""
"AGCポリマー建材株式会社",""
"東亜建設工業株式会社",""
"株式会社島村工業",""
"荏原商事",""
"ユニカ株式会社",""
"株式会社不二ビルサービス",""
"双葉電子工業株式会社",""
"中央日土地ソリューションズ株式会社",""
"株式会社龍美一級建築士事務所",""
"田島ルーフィング株式会社",""
"グローブライド株式会社",""
"きまちアーキテクト株式会社",""
"株式会社東急設計コンサルタント",""
"Nikkensekkei",""
"三菱電機ビルソリューションズ株式会社",""
"株式会社小林石材店",""
"三光ソフラン株式会社",""
"SBI証券",""
"三井化学株式会社",""
"株式会社岐阜造園",""
"ソフトバンク株式会社",""
"株式会社Growing up",""
"国立研究開発法人NEDO",""
"株式会社ふすま",""
"株式会社フォーデック",""
"株式会社建築工房時温",""
"アルデ アーキテクト&アソシエイツ",""
"アルスホーム株式会社",""
"小河建築設計事務所",""
"株式会社蔵王建設",""
"福島県インテリアコーディネーター協会",""
"株式会社プラスチックアーキテクツ",""
"建築事務所TESSEN",""
"株式会社スリースター",""
"株式会社カプテリ",""
"株式会社ワカタケ",""
"株式会社ココディレクション",""
"西畑設計",""
"富田商事株式会社",""
"株式会社ドムコス",""
"株式会社フィールド・デザイン・アーキテクツ一級建築士事務所",""
"JBリアルエステート株式会社",""
"株式会社良品計画",""
"株式会社マルモリカンパニー",""
"株式会社CABN",""
"四反田建築設計事務所",""
"株式会社フジタ 建築本部 BIM推進統括部",""
"株式会社クラウドトップ",""
"センコー産業株式会社",""
"株式会社ノットコーポレーション",""
"株式会社 秋山立花",""
"ノーマンズランドアソシエイツ1級建築士事務所",""
"オゾン設計室",""
"株式会社テイクアンドギヴ・ニーズ",""
"K2デザインオフィス",""
"株式会社ウィローズクラフト",""
"株式会社三木組",""
"エステック不動産投資顧問株式会社",""
"株式会社RYアーキテクツ",""
"株式会社モーラデザイン",""
"株式会社ユニフィット",""
"カモン・アンド・アソシエイツ",""
"有限会社芝田工務店",""
"株式会社nest建築設計室",""
"株式会社野村工務店",""
"OPERA",""
"NTTファシリティーズエンジニアリング株式会社",""
"グローアップ",""
"大建興産株式会社",""
"株式会社フューチャースケッチ",""
"株式会社AYNZ",""
"MtoMカンパニー",""
"株式会社東畑建築事務所",""
"株式会社よねざわ工業",""
"株式会社ニッセイ",""
"i設計エンジニアリング",""
"バリュークリエイト",""
"メガソフト",""
"JR西日本プロパティーズ",""
"株式会社ワンズ・レーニア",""
"アクシスプランニングジャパン",""
"株式会社小河原建設",""
"積水ハウス建設東京株式会社",""
"二和木材",""
"東京アドワイズ",""
"ダイテック",""
"AITech",""
"有限会社斎藤建設",""
"株式会社マルサ佐藤建設",""
"DMカードジャパン",""
"Prostyle",""
"三菱地所ホーム株式会社",""
"株式会社Value-Connect",""
"うかいオフィス",""
"アトリエ プルネポン",""
"株式会社 空間デザイン",""
"有限会社インテリアオオツカ",""
"ワカバヤシ",""
"株式会社花田工務店",""
"株式会社フォーユー",""
"福井コンピュータアーキテクト株式会社",""
"ポラテック富士株式会社",""
"住宅産業研究所",""
"ISCクリエイティブ",""
"キャドセンター",""
"BIPROGY株式会社",""
"住宅デバイス共創機構",""
"三和システムウォール",""
"タカマツビルド株式会社",""
"Housing-Nudge",""
"三井ホーム株式会社",""
"mucu",""
"エムエム建材",""
"株式会社フレスコ",""
"大樹生命",""
"プライムトラス",""
"すまてっく",""
"TFD",""
"株式会社ドラフト",""
"ラクスル",""
"三菱電機住環境システムズ株式会社",""
"三菱電機ソフトウエア",""
"株式会社さくら",""
"LogAsset",""
"東急株式会社",""
"リバース",""
"株式会社ムラヤマ",""
"日本プレカットシステム",""
"宮本工業",""
"東京アセットソリューション",""
"ZAZA",""
"東急リバブルスタッフ株式会社",""
"woodwise llc",""
"井上建設株式会社",""
"株式会社フェイスネットワーク",""
"大洋建設",""
"ハイビック",""
"堀内鋼業",""
"ティンバーインプ",""
"S&U",""
"石川設計",""
"ハウセット",""
"クライムアーツ",""
"香陵住販株式会社",""
"桜上居",""
"株式会社菊地建築設計事務所",""
"中電技術コンサルタント株式会社",""
"イビケン",""
"北芝建設",""
"大井",""
"ロータス",""
"株式会社スペースリー",""
"丸紅",""
"ユーフォニック",""
"徳普化学",""
"アサノ札幌営業所",""
"ハイブリッジ",""
"松林建築設計事務所",""
"輝栄",""
"エムドラド",""
"パナソニックエレクトリックワークス株式会社",""
"アドレス",""
"日東電工株式会社",""
"広島建設",""
"東急建設株式会社",""
"株式会社ウッドワン",""
"ペナント",""
"株式会社タス",""
"野村證券",""
"北海道コカ・コーラボトリング",""
"感動ハウス",""
"タカキ",""
"株式会社ナカノフドー建設",""
"Bullex Schwall",""
"住商ビルマネージメント株式会社",""
"株式会社クローバーホーム",""
"コリドー青山",""
"株式会社ミズノデザイン",""
"KATOホールディングス",""
"日本遠東KPK",""
"ナスタ",""
"東洋不動産",""
"株式会社YUASA",""
"ハンズグローバル",""
"東京都住宅供給公社",""
"株式会社eeeats",""
"ジバンネット",""
"星山商事",""
"株式会社富本設計",""
"木村不動産",""
"かじまや",""
"セット設計事務所",""
"北海道警察本部",""
"セイウン不動産",""
"Con mi perro",""
"DEUX TOURS",""
"広友物産",""
"X-HEMISTRY",""
"株式会社長谷工コーポレーション",""
"興建社",""
"BREXA Technology",""
"永見建築設計事務所",""
"ベクターワークスジャパン",""
"三建エンジニアリングサービス",""
"仙台都市計画株式会社",""
"ナブコドア株式会社",""
"デュポン・スタイロ",""
"日本紙通商株式会社",""
"イノマタ",""
"マルオカ",""
"エムズクラフト",""
"不二家システムセンター",""
"メタテクノ",""
"レバテック株式会社",""
"ou2",""
"池上企画",""
"NXリゾート",""
"KN村田産業株式会社",""
"城南職業開発センター",""
"静岡県経済連一級建築士事務所",""
"ファミリーコーポレーション",""
"東京都中小企業振興公社",""
"三井デザインテック 株式会社",""
"株式会社 グレート",""
"リーガルスムーズ",""
"トーヨーカネツビルテック",""
"福井コンピュータホールディングス",""
"ファインディ",""
"おかだハウジング",""
"株式会社リフォーム産業新聞社",""
"ベルシステム24",""
"ALEC設計工房",""
"ヤマダホームズ",""
"株式会社ナック",""
"マルニシ",""
"オリジナルテクスト",""
"らくど一級建築士事務所",""
"株式会社森未来",""
"キクザワ",""
"株式会社アーキテクト・ディベロッパー",""
"日鉄興和不動産コミュニティ 株式会社",""
"サイリージャパン",""
"リノシスコーポレーション",""
"株式会社髙松都市開発",""
"株式会社安成工務店",""
"地盤ネット株式会社",""
"海上保安試験研究センター",""
"新昭和",""
"ダイアパレス吉祥寺",""
"城南職業能力開発センター",""
"PDC",""
"フレッシュハウス",""
"みづほ工業株式会社",""
"えん",""
"ナイス株式会社",""
"菊地設計",""
"ツツミ建築設計室",""
"ノースサンド",""
"株式会社デザインアーク",""
"共同カイテック",""
"大豊建設株式会社",""
"ミサワリフォーム株式会社",""
"NTY不動産開発株式会社",""
"佐藤秀",""
"株式会社center",""
"クリエイティブ・スタジオ株式会社",""
"山手総合計画研究所",""
"SpaciaNetJapan",""
"いしかわ",""
"松井産業",""
"大東建託株式会社",""
"ウッドエンジニアリング",""
"KINO BIM",""
"株式会社パックシステム",""
"リストデベロップメント株式会社",""
"株式会社天然住宅",""
"レジェンドホーム",""
"神奈川県民球団",""
"三協立山株式会社",""
"コンセプティエ・リアルティ",""
"綿半ソリューションズ株式会社",""
"中原クリーンサービス",""
"秀光ビルド",""
"小島屋",""
"オデッサ択して下さい",""
"株式会社前田",""
"代表取締役",""
"D4U Studio",""
"永大産業",""
"大王製作所",""
"ASO Property Japan株式会社",""
"株式会社アトリエユニゾン",""
"株式会社コムプラン",""
"ポート",""
"株式会社コモンプロダクツ",""
"Frosch住宅調査改修設計室",""
"京都市",""
"構造計画研究所",""
"株式会社プロトソリューション",""
"スカパーJSAT",""
"光洋建設株式会社",""
"サンユー建設",""
"北ガスライフロント",""
"ライブフォー",""
"株式会社ハウスジーメン",""
"株式会社エム・シー・サービス",""
"SANAA",""
"SANAA事務所",""
"Platanus",""
"株式会社船場",""
"Asiax",""
"フラット・ファイブ",""
"AFFORD DESIGN",""
"キーテック",""
"Re-grit Partners",""
"CST",""
"株式会社明豊プロパティーズ",""
"太平製作所 大阪事業部",""
"ライフデザイン・カバヤ",""
"サンヨーベストホーム",""
"株式会社JTBアセットマネジメント",""
"TOKO",""
"クロスリンク株式会社",""
"三井不動産投資顧問",""
"グローバルソリューションサービス",""
"山田建設株式会社",""
"AGC",""
"有限会社 スリーディー",""
"株式会社飯田組",""
"ブランドクラウド",""
"一般財団法人ベターリビング",""
"オルトメディコ",""
"アクチュアル",""
"三井不動産レジデンシャル株式会社",""
"株式会社ハウスメイトマネジメント",""
"伊藤忠建材株式会社",""
"富士計器",""
"先端建設技術センター",""
"ベネッセコーポレーション",""
"Finbase",""
"下西技研工業",""
"前田建設工業 株式会社",""
"株式会社エヌ・シー・エヌ",""
"株式会社サンケイビル",""
"スターツCAM株式会社",""
"株式会社ザイマックス",""
"メルクマール",""
"日本郵政建築株式会社",""
"近鉄不動産株式会社",""
"日豊商事",""
"キャッツ",""
"千葉誠",""
"りそなホールディングス",""
"あいホーム",""
"松本工業",""
"楠山設計",""
"群馬セキスイハイム株式会社",""
"TAIMATSU/TAIMATSU HOMES",""
"TAIMATSU",""
"TAIMATSU HOMES",""
"ZWSOFT Japan",""
"ワイテック",""
"45.r",""
"アセットコンサルティングネットワーク",""
"エリアリンク",""
"カシワバラ・コーポレーション",""
"株式会社 レイシャス",""
"オブジェクト設計",""
"日本物産",""
"清水建設 株式会社",""
"maxiv",""
"株式会社 スタジオブロス",""
"株式会社 アサンテ",""
"三井不動産株式会社",""
"株式会社山田特殊技研DICE",""
"京成建設株式会社",""
"株式会社みらいパートナーズ",""
"サンタ通商",""
"イノーヴ",""
"一般社団法人マンション管理業協会",""
"株式会社リバラクト",""
"ジェイアール貨物・不動産開発",""
"ハウジング・スタッフ",""
"株式会社クローバー",""
"アイケンジャパン",""
"レジデンス持田",""
"ロイヤル",""
"株式会社フジタ",""
"東映コミュニケーションズ",""
"中日本ハイウェイ・エンジニアリン東京",""
"富士住建",""
"南陽吉久",""
"株式会社ウッディパーツ",""
"カワイ音響システム",""
"DAIKEN株式会社",""
"株式会社猛建設",""
"クラシテ不動産",""
"日本製紙木材株式会社",""
"ミライの住宅",""
"つなぐ-en-システム",""
"東方地所 株式会社",""
"京急ビルマネジメント",""
"UNDER & Co.",""
"ファーストウッド株式会社",""
"イワクラ",""
"若井産業",""
"伊藤忠ハウジング",""
"アイビルド",""
"株式会社 西崎組",""
"日本環境アメニティ 株式会社",""
"大和ハウス賃貸リフォーム株式会社",""
"工房•Muscle",""
"太豊建設株式会社",""
"ナイカイアーキット",""
"ailead",""
"東硝興業",""
"クレバリーホーム",""
"D-FORP",""
"アポイント",""
"ホームベース株式会社",""
"株式会社一寸房",""
"セブン工業株式会社",""
"ジャパン建材",""
"my home",""
"大倉建築事務所",""
"日本ERI",""
"メガクリエイト",""
"近藤建設株式会社",""
"株式会社フィル・カンパニー",""
"東急住宅リース株式会社",""
"株式会社中央ビル管理",""
"アベルコ",""
"スターツホーム",""
"デュナミス・パートナーズ",""
"工藤建設",""
"株式会社熊谷組",""
"株式会社ウエストビレッジ",""
"米子工業高等専門学校",""
"首都高速道路株式会社",""
"大藏木材工芸株式会社",""
"CORRECT",""
"全国賃貸住宅新聞社",""
"DORCUSS",""
"個人",""
"グローバルトラストネットワークス",""
"カナメイシ",""
"スターテング工業",""
"株式会社サイエホーム",""
"株式会社WHERE",""
"住友林業株式会社",""
"東建コーポレーション株式会社",""
"Diamond Park",""
"やまと建築事務所",""
"株式会社パートナーリンク(光通信Grp)",""
"テストー",""
"ワプル",""
"パナソニック ハウジングソリューションズ 株式会社",""
"楽天グループ株式会社",""
"株式会社NOW",""
"株式会社エッグハウジング",""
"株式会社GEN INOUE",""
"株式会社デュアルタップ",""
"PREインベストメント株式会社",""
"竹下和宏建築設計事務所",""
"fragment.archoffice",""
"株式会社IGK",""
"アーキデザイン株式会社",""
"コクヨマーケティング株式会社",""
"株式会社エリオクリエイト",""
"Shiny’s Creative",""
"asazu design office",""
"デザインアーク(大阪)",""
"株式会社ウチダシステムズ",""
"株式会社エルシード",""
"あおぞら工務店株式会社",""
"株式会社MONO-GRAPH",""
"株式会社インテリジェントフォース",""
"株式会社TwinCompany",""
"羽鳥 勘太",""
"blanco graphics",""
"Tofu 設計事務所",""
"カリコ株式会社",""
"株式会社やまひろ",""
"株式会社家計画",""
"丸協建設株式会社",""
"株式会社ホーム・テック",""
"株式会社タナカ",""
"株式会社北伸総建",""
"株式会社モリタ",""
"YMホームズ株式会社",""
"株式会社真和建設",""
"有限会社阿部建工",""
"株式会社石塚建設",""
"株式会社コスカ",""
"高木建設株式会社",""
"有限会社斉藤建具製作所",""
"北垣建設工業株式会社",""
"松栄建設株式会社",""
"株式会社小川建設",""
"三光建設株式会社",""
"有限会社緑建",""
"丸善木材株式会社",""
"北原建設有限会社",""
"株式会社春日建設",""
"株式会社青木建設",""
"有限会社マルフジ建設",""
"株式会社剛健",""
"フェアリーホーム株式会社",""
"堀建設有限会社",""
"北登建設工業株式会社",""
"有限会社圓工務舎",""
"有限会社今野建設",""
"株式会社リビングワーク",""
"株式会社ニーズプロジェクト",""
"有限会社ハルミ工業",""
"有限会社北嶺建設",""
"株式会社渡部製作所",""
"株式会社フジックス",""
"協栄工業株式会社",""
"有限会社クワサコ住建",""
"株式会社甲谷建設",""
"小野寺燃料株式会社",""
"株式会社フォレスタ",""
"株式会社エースホーム",""
"株式会社アーキコーポレーション",""
"アトリエテッラ株式会社",""
"株式会社ファウンド",""
"有限会社山崎工務店",""
"株式会社リヴウェル",""
"株式会社ベルライフ",""
"黒崎建設株式会社",""
"株式会社アトラスグループ",""
"山新建設株式会社",""
"大進ホーム株式会社",""
"有限会社エステートコム",""
"株式会社フォートライフ",""
"株式会社匠建",""
"トーリツ株式会社",""
"株式会社ケーアンドエスクラフト",""
"株式会社総合プランニングセンター",""
"株式会社井上技研",""
"株式会社クレスト・ホーム",""
"株式会社ノースファイン・プランニング",""
"株式会社内山",""
"株式会社エコロジーライフ",""
"株式会社ケーエス・ディー",""
"株式会社札幌リフォームセンター",""
"有限会社建築工房木の森",""
"日本アーク開発株式会社",""
"株式会社アーキブルグ",""
"株式会社AGGRE",""
"北海道相互建設株式会社",""
"株式会社イーブランド",""
"山忠高島建設株式会社",""
"有限会社クラークホームズ",""
"晃和住宅株式会社",""
"株式会社スガケン",""
"東陽ハウス株式会社",""
"株式会社マルワホーム企画",""
"西澤建設株式会社",""
"三井ホーム北海道株式会社",""
"合同会社NorthernEarth",""
"株式会社橋本建設",""
"有限会社小本建設",""
"株式会社建築工房サトウ",""
"株式会社宮崎組",""
"株式会社協栄ハウス",""
"株式会社ホクセイ・ホーム",""
"株式会社弘和建設工業",""
"株式会社畑中産業",""
"有限会社カネゼン建設",""
"株式会社鈴蘭不動産",""
"株式会社伊善建設",""
"有限会社ハヤサカコンサルタント",""
"有限会社広岡建設",""
"株式会社住計画FURUTA",""
"有限会社河瀬技建工業所",""
"株式会社高坂ホーム",""
"株式会社アクト",""
"株式会社エーワンホーム",""
"久慈建築工房有限会社",""
"カンノホーム株式会社",""
"有限会社ハートフルホーム",""
"株式会社みねるば建築不動産",""
"有限会社小田建設",""
"株式会社空間工房",""
"株式会社カネ武組",""
"藤建設株式会社",""
"有限会社北翔建設",""
"株式会社ベルン",""
"山下建設株式会社",""
"有限会社ハウスビルダーセルズ",""
"大坪建設株式会社",""
"株式会社中村建設",""
"真下建設株式会社",""
"有限会社共和住設",""
"有限会社設計工房アーキトレーヴ",""
"三光工業株式会社",""
"有限会社オカダ建装",""
"有限会社グッドコム",""
"村山ギソー株式会社",""
"廣木建設株式会社",""
"有限会社工藤宅建",""
"株式会社ダイイチ",""
"佐々木・広谷建設株式会社",""
"辻木材株式会社",""
"鈴木建設株式会社",""
"株式会社吉田組",""
"株式会社高橋組",""
"株式会社三和建設",""
"有限会社松岡技建",""
"株式会社宮田建設",""
"有限会社吉田ハウス",""
"株式会社道和建設",""
"ワコー建設株式会社",""
"光輝建設株式会社",""
"株式会社岡本建設",""
"株式会社吉田建設",""
"亀田工業株式会社",""
"株式会社赤坂建設",""
"株式会社三五工務店",""
"株式会社盛新建設システム",""
"ハウジング山地株式会社",""
"有限会社原田工務店",""
"株式会社長谷川建設",""
"有限会社トレーダー",""
"株式会社ひまわりてれび",""
"株式会社大樹工業",""
"株式会社古川電機製作所",""
"株式会社みつひら産業",""
"株式会社輝石",""
"あけぼの建設株式会社",""
"有限会社昭和設備設計事務所",""
"梶原実業株式会社",""
"株式会社長崎リサイクルサービス",""
"株式会社KOKEN",""
"株式会社大協",""
"リフォームらいと株式会社",""
"有限会社北川カッター工業",""
"丸喜株式会社齋藤組",""
"株式会社松本工務店",""
"タナカホーム株式会社",""
"有限会社協栄会",""
"ヤマメイ株式会社",""
"有限会社ファンクショナルアーツ",""
"株式会社建築住宅センター",""
"大上木材工業株式会社",""
"株式会社八洲建築設計事務所",""
"株式会社松橋不動産",""
"有限会社二唐刄物鍛造所",""
"弘和建設株式会社",""
"株式会社高松工業",""
"東京冷熱株式会社",""
"川浪不動産株式会社",""
"株式会社向井工務店",""
"株式会社成文組",""
"株式会社ユリカ",""
"株式会社菊池組",""
"有限会社柏工務店",""
"株式会社コアラハウス",""
"株式会社ビエント",""
"株式会社住光建業",""
"株式会社サカモト住建",""
"株式会社建匠おだぎり",""
"株式会社森田建設",""
"あすなろ不動産株式会社",""
"有限会社太田技建",""
"小館木材株式会社",""
"ニコクホーム株式会社",""
"株式会社横内建築設計事務所",""
"有限会社大坊建設",""
"株式会社ミゾエホーム",""
"株式会社千代田不動産",""
"有限会社ヤマト設計工房",""
"青菱建設株式会社",""
"有限会社山一建工",""
"大澤ホーム有限会社",""
"レガロホーム株式会社",""
"株式会社肥後産業",""
"株式会社オハナ",""
"有限会社南部開発",""
"タップサービス株式会社",""
"有限会社エルシィホーム",""
"株式会社Fractal設計事務所",""
"株式会社シーエスホーム",""
"石田産業株式会社",""
"有限会社宮古工務店",""
"株式会社狩野尾建築設計事務所",""
"西部不動産株式会社",""
"有限会社クレイドル",""
"ファインホームズ株式会社",""
"株式会社ウィンコーポレーション",""
"株式会社森のハウス",""
"株式会社大高住設",""
"イシオカホーム株式会社",""
"有限会社舛舘工務店",""
"株式会社ピュアハート",""
"トウエー株式会社",""
"株式会社みちのく不動産",""
"株式会社みちのく庭園",""
"株式会社鳥谷部建設",""
"パックス有限会社",""
"株式会社シンプルライフ",""
"株式会社大室建築",""
"株式会社すまくら",""
"有限会社松浦建設",""
"有限会社丸二建設",""
"株式会社リイル宅建事務所",""
"株式会社感動ハウス弘前",""
"有限会社不動産プラザ",""
