"Name","Website"
"株式会社アーキプラン",""
"有限会社インテリアニッセン",""
"株式会社エルハウス",""
"有限会社湯本建設",""
"株式会社小泉建築",""
"小竹建設有限会社",""
"株式会社トモノ",""
"有限会社森山工務店",""
"三好屋建設株式会社",""
"有限会社向山工務店",""
"株式会社ダイワテック",""
"クラシマ建設株式会社",""
"株式会社東洋エンジニヤリング",""
"有限会社山田建築所",""
"有限会社フジミ工務店",""
"有限会社みすゞ設計",""
"株式会社アロー設計",""
"株式会社アスナス",""
"株式会社降幡建築設計事務所",""
"有限会社金澤建設工業",""
"有限会社花岡建設",""
"株式会社協同コンサル",""
"株式会社Y建築設計",""
"株式会社大工原建築",""
"トレスホームズ株式会社",""
"有限会社ミヤシタ設計",""
"システムプラン・ドゥー株式会社",""
"株式会社エイ・デザイン",""
"株式会社林魏建築設計事務所",""
"株式会社アーバー",""
"塚田建設株式会社",""
"有限会社松下企画設計事務所",""
"有限会社松林都市建築計画",""
"株式会社清水建築",""
"望月ガス株式会社",""
"株式会社タカネヒューマンサポート",""
"株式会社グランベール計画",""
"有限会社篠原工務店",""
"飯田建設株式会社",""
"笠井工業株式会社",""
"有限会社小林工務店",""
"有限会社渡辺建築設計事務所",""
"山﨑建設株式会社",""
"株式会社グリーンベル",""
"有限会社岡江組",""
"更級圭建築設計株式会社",""
"有限会社フィールドワーク",""
"有限会社宗政",""
"オータ住環境株式会社",""
"株式会社E-デザイン",""
"株式会社ミセキ",""
"有限会社マル和建設",""
"有限会社勝家建築研究室",""
"株式会社エフエムディー設計",""
"未来ネットワーク株式会社",""
"株式会社くみきハウス",""
"有限会社トムズホーム",""
"株式会社田村建築設計",""
"丸山建設株式会社",""
"株式会社建築研究所フォーラム",""
"有限会社飯島木工",""
"ファシリティ情報サービス株式会社",""
"株式会社小林組",""
"有限会社ガンバ建築設計",""
"株式会社山二ハウジング",""
"有限会社駒澤工務店",""
"大蔵建設株式会社",""
"GTO株式会社",""
"有限会社住まい考房",""
"株式会社林建築設計室",""
"協同建設株式会社",""
"株式会社創和設計",""
"日々此建築株式会社",""
"株式会社城取建築設計事務所",""
"株式会社後澤建築設計事務所",""
"有限会社不動産設計安曇野森",""
"株式会社山口設計事務所",""
"箕輪建設工業株式会社",""
"株式会社グローバル企画設計",""
"SUNRISE株式会社",""
"有限会社松本コンストラクションサービス",""
"株式会社ガド建築設計事務所",""
"有限会社下倉設計",""
"有限会社橋建",""
"有限会社君島弘章建築設計事務所",""
"株式会社イマイ企画",""
"三愛株式会社",""
"株式会社赤羽設計事務所",""
"株式会社太洋",""
"長野住宅診断株式会社",""
"株式会社バイオ・ベース",""
"株式会社mA建築計画工房",""
"株式会社青い風",""
"波田木材株式会社",""
"有限会社カインドワークス",""
"株式会社エム建築設計事務所",""
"株式会社ウッドビルド",""
"株式会社滝澤工務店",""
"有限会社井出宅建",""
"株式会社アルプスピアホーム",""
"コロナ住宅",""
"KanadeRoom",""
"株式会社タナカ綜合環境設計",""
"有限会社藤原塗装",""
"クラウド住宅販売株式会社",""
"有限会社さわばん",""
"株式会社大成産業",""
"有限会社西村木材産業",""
"三承工業株式会社",""
"ヤベホーム株式会社",""
"有限会社松波建設",""
"株式会社パパスアンドママス",""
"株式会社マシナリーテック",""
"永井建設株式会社",""
"株式会社タカオホームソリューションズ",""
"岐南興業株式会社",""
"共栄土木建築株式会社",""
"久世工業株式会社",""
"矢島建設興業株式会社",""
"エンジニアリングホーム株式会社",""
"株式会社雛屋建設社",""
"株式会社エムズアソシエイツ",""
"オオタケ環境計画株式会社",""
"石橋コンクリート工業株式会社",""
"株式会社カワシマ工務店",""
"篠田建設株式会社",""
"仲谷住宅株式会社",""
"株式会社松由建設",""
"株式会社グランハウス",""
"株式会社ヒカリ中村",""
"株式会社歩設計",""
"有限会社柴木材",""
"有限会社寺町木材",""
"株式会社ルートウェイ",""
"森宮建設株式会社",""
"株式会社大政建築",""
"株式会社ソーマス岐阜",""
"中日建材株式会社",""
"岩井建設株式会社",""
"株式会社サンセイ建設",""
"株式会社アルカディアホーム",""
"株式会社テクノハウス岐阜",""
"株式会社馬田工務店",""
"フロンティアホーム株式会社",""
"永吉建設株式会社",""
"株式会社熊澤工務店",""
"丹羽木材株式会社",""
"株式会社丸久大野建設",""
"有限会社加藤住建産業",""
"株式会社トーワホーム",""
"大和創見株式会社",""
"フルハウス株式会社",""
"有限会社エステートマツイ",""
"株式会社松原建築商事",""
"谷本建設株式会社",""
"株式会社窪江建築設計事務所",""
"ヤマカトラストホームズ株式会社",""
"株式会社鈴村建設",""
"株式会社トータルフォーム",""
"株式会社エコストック",""
"株式会社ボーイカンパニー",""
"丸信住宅株式会社",""
"関谷建設株式会社",""
"オグリ建託株式会社",""
"栃井建設工業株式会社",""
"株式会社現代設計事務所",""
"空間建築工房",""
"丸曽建設株式会社",""
"西海地研株式会社",""
"有限会社岩一建設",""
"有限会社西彼商会",""
"振興産業株式会社",""
"株式会社谷野電機空調",""
"株式会社稲崎産業",""
"株式会社ホームコンサルティング長崎",""
"株式会社丸栄組",""
"有限会社海老沼造園",""
"川添硝子株式会社",""
"太田産業株式会社",""
"西州建設株式会社",""
"有限会社喜々津ガラスアルミセンター",""
"株式会社アトラス建設",""
"有限会社小長井建設",""
"植松一級建築士事務所",""
"岡工建設株式会社",""
"株式会社小柳",""
"株式会社サンライフ商事",""
"株式会社丸大製材所",""
"株式会社益永工業",""
"有限会社常勝建工",""
"株式会社タメナガ造園",""
"岩永木材有限会社",""
"株式会社時津鉄工所",""
"服部電工株式会社",""
"九州物産株式会社",""
"有限会社学企画建設",""
"株式会社オーテック",""
"株式会社マツヤ産業",""
"有限会社ヒロシ畳店",""
"株式会社新栄建設",""
"伊藤建築株式会社",""
"株式会社ショーエイ",""
"株式会社侘蔵",""
"株式会社feels",""
"津島興業株式会社",""
"福岡建設株式会社",""
"有限会社北原一建設",""
"株式会社東建",""
"株式会社大藤",""
"有限会社脇義建築",""
"有限会社北川板金工業",""
"株式会社梶浦工務店",""
"株式会社かん・ぜおん",""
"株式会社賀真田工務店",""
"株式会社プラザ",""
"アキトチ工務店株式会社",""
"株式会社ナビハウス",""
"有限会社スペースヒラノ",""
"株式会社加藤工務店",""
"株式会社野々山木材",""
"株式会社ジェネラルアメリカンホーム",""
"フレンズホーム株式会社",""
"松岡建設株式会社",""
"東洋建設株式会社",""
"株式会社スマイル建装",""
"株式会社丸喜工務店",""
"交芳建設株式会社",""
"株式会社レジェンダリーホーム名古屋",""
"児島産業株式会社",""
"梶田建設株式会社",""
"株式会社ホームランディック",""
"株式会社ダイカネ技建",""
"ベッセル建築計画株式会社",""
"株式会社ラビングホーム",""
"株式会社水野商会",""
"有限会社リアルプランナー",""
"OPUSスタイル株式会社",""
"堀本住宅株式会社",""
"株式会社藤井組",""
"有限会社三京住宅",""
"有限会社泰匠",""
"株式会社幸栄住建",""
"株式会社三浦工務店",""
"有限会社片岡建築",""
"株式会社アニバーサリーホーム",""
"太陽住宅株式会社",""
"株式会社平田創建",""
"株式会社フォレスト工房",""
"株式会社岡戸組",""
"株式会社iiie",""
"ベイホーム株式会社",""
"有限会社中野建築",""
"大羽建設株式会社",""
"竹内合名会社",""
"坂猛建設有限会社",""
"有限会社早川建築",""
"株式会社ダイチ",""
"有限会社中山工務店",""
"株式会社ジャスト",""
"株式会社サンフォレスト",""
"株式会社拓穂工務店",""
"株式会社清久建設",""
"ニッシンホームズ株式会社",""
"株式会社まちづくり",""
"有限会社サンナップ",""
"有限会社内藤工務店",""
"タカコー株式会社",""
"株式会社大清工務店",""
"アポロホーム株式会社",""
"株式会社KAMIYAHOME",""
"名倉建設株式会社",""
"合資会社服部不動産",""
"大鈴建設株式会社",""
"株式会社河合工務店",""
"有限会社トウシンホーム",""
"株式会社連瓦",""
"エコウットテック有限会社",""
"有限会社山建工務店",""
"株式会社エムジーエー",""
"株式会社ハウジングエム",""
"有限会社近藤工務店",""
"株式会社ウッドライフ",""
"株式会社ミトウ住宅",""
"マルス建設株式会社",""
"株式会社ライフタイム",""
"株式会社白武",""
"株式会社ISE",""
"隼人建設株式会社",""
"株式会社太平建設",""
"伸和建設株式会社",""
"株式会社冨士工務店",""
"船戸建設株式会社",""
"株式会社岡工務店",""
"ハウスエナジー株式会社",""
"株式会社長岡建設",""
"株式会社土樹和",""
"株式会社アイホー",""
"株式会社ニシジマホームズ",""
"フロンヴィルホームデザイン株式会社",""
"株式会社黒宮建設",""
"有限会社原田建築",""
"株式会社永冨",""
"株式会社コスモハウス",""
"有限会社ハウスプランニング",""
"新興建設株式会社",""
"有限会社梶田工務店",""
"有限会社ボーグ",""
"株式会社ライフデザインクリエイターズ",""
"株式会社優和",""
"株式会社ハウスクリップ",""
"株式会社レップス",""
"株式会社鈴木設計事務所",""
"あいち建設株式会社",""
"株式会社トスコ",""
"株式会社渡辺建設",""
"春田建設株式会社",""
"株式会社大邦建設",""
"名古屋建物株式会社",""
"有限会社アクアホーム",""
"サイトウホーム株式会社",""
"鏡味建築株式会社",""
"日比野建設株式会社",""
"株式会社スマートコーポレーション",""
"川辺建設株式会社",""
"辻創建株式会社",""
"長縄建築株式会社",""
"誠和建設株式会社",""
"株式会社北川建設",""
"株式会社秋田建設",""
"東名ホームズ株式会社",""
"ヘンリーモリス株式会社",""
"株式会社下栄",""
"タマキ建設株式会社",""
"株式会社東海・ビルド",""
"有限会社アメミヤ建設",""
"有限会社大島建築",""
"有限会社建築創造舎アトリエK",""
"株式会社ゴールデンハウス",""
"株式会社エーケーホーム",""
"JSK住環境総合計画",""
"株式会社伊久間",""
"アイランドホーム株式会社",""
"共新電設工業株式会社",""
"有限会社一良建設",""
"有限会社中央電機製作所",""
"有限会社西九州メディア",""
"株式会社本澤崇設計事務所",""
"有限会社ライテック",""
"株式会社カイダ・アイフルケア",""
"株式会社ビー・クリエート",""
"株式会社ムカイ技研",""
"大洋造船鉄工有限会社",""
"有限会社吉田鉄骨",""
"平安住宅株式会社",""
"有限会社松橋トレイディング",""
"アースオリティ株式会社",""
"ダイヤリックス株式会社中部支社",""
"株やまぜんホームズ",""
"有限会社山本設計",""
"有限会社大幸",""
"有限会社阪竹男建築研究所",""
"有限会社白川マイホーム",""
"株式会社ながはま",""
"有限会社シカタマテリアル",""
"株式会社あおぞら不動産",""
"福丸建設株式会社",""
"長崎電業株式会社",""
"有限会社広輝緑化",""
"株式会社アトリエ・プランニング",""
"有限会社明生興産",""
"有限会社大富建設",""
"千代田通商株式会社",""
"有限会社辻建板工業",""
"タナカ電設株式会社",""
"株式会社ボンズカンパニー",""
"株式会社長崎オムコライフ",""
"株式会社桑原組",""
"滋賀設備株式会社",""
"株式会社奥田工務店",""
"キタイ設計株式会社",""
"アヤハ不動産株式会社",""
"株式会社内田組",""
"株式会社向茂組",""
"辻寅建設株式会社",""
"ア・ア・ンコーポレーション株式会社",""
"株式会社野洲サルベージ",""
"湖東興産株式会社",""
"株式会社安田組",""
"大栄工機株式会社",""
"株式会社大生産業",""
"株式会社材光工務店",""
"株式会社笹川組",""
"一圓テクノス株式会社",""
"喜多嘉和株式会社",""
"株式会社MIC",""
"株式会社新洲",""
"株式会社マツナガ",""
"株式会社たかはし",""
"セキスイ管材テクニックス株式会社",""
"株式会社キョーリン",""
"大崎設備工業株式会社",""
"株式会社丸多運送",""
"株式会社千商",""
"株式会社岡山建設",""
"北川産業株式会社",""
"株式会社丸屋建設",""
"株式会社アクティブ",""
"株式会社久木野工務店",""
"株式会社ルポハウス",""
"株式会社I・HOme",""
"株式会社ピアライフ",""
"京阪グリーン株式会社",""
"株式会社小漆間工業",""
"株式会社ナルディック",""
"株式会社テクノミツボシ",""
"有限会社岡田工業",""
"株式会社水原建築設計事務所",""
"株式会社大橋",""
"大輪建設株式会社",""
"甲賀電気設備株式会社",""
"株式会社宝山園",""
"株式会社サンセイ",""
"株式会社北中工業",""
"株式会社ノセヨ",""
"有限会社シガオータランバー",""
"華建築株式会社",""
"谷庄建設株式会社",""
"sublime不動産販売株式会社",""
"近江道路土木株式会社",""
"株式会社関西水資源管理サービス",""
"甲共舗道株式会社",""
"株式会社シンコー",""
"ダイワエンジニアリング株式会社",""
"平田建設株式会社",""
"株式会社田中誠文堂",""
"株式会社大西デンキシステム",""
"双葉建設株式会社",""
"有限会社保海瓦工業",""
"株式会社大伴組",""
"株式会社重田組",""
"有限会社リブハウス工房",""
"甲賀林材株式会社",""
"環境創研株式会社",""
"株式会社田中水道",""
"株式会社さんでん",""
"株式会社川新",""
"株式会社花芳",""
"株式会社河村工務店",""
"大橋電設株式会社",""
"奥儀運送株式会社",""
"太陽舗道株式会社",""
"株式会社竹六商店",""
"株式会社日研",""
"今明水道株式会社",""
"株式会社湖東重機",""
"飯室電業株式会社",""
"株式会社キッパーズ",""
"藤和ステップ株式会社",""
"豊栄建設株式会社",""
"株式会社サンテック",""
"大津マルヰ株式会社",""
"株式会社西澤工務店",""
"株式会社グロー・ガステック",""
"株式会社山重建設",""
"佐々木工業株式会社",""
"株式会社辻芳組",""
"株式会社京滋建設",""
"株式会社山田建材",""
"株式会社きたそう",""
"株式会社坂本建設",""
"株式会社三共",""
"有限会社西川技建工業",""
"那須緑地株式会社",""
"株式会社平山工務店",""
"株式会社宮本組",""
"大晶電気株式会社",""
"株式会社ハチキ",""
"株式会社マルモト",""
"株式会社ビエンカサ",""
"橋本クリーン産業株式会社",""
"村防工業株式会社",""
"近江花勝造園株式会社",""
"油藤商事株式会社",""
"ハウジング光正株式会社",""
"有限会社寺居電器商会",""
"株式会社スムース",""
"株式会社秀月",""
"有限会社西村瓦店",""
"山上株式会社",""
"有限会社光商店",""
"ベストワークス株式会社",""
"清水工業株式会社",""
"ヤマト管工株式会社",""
"中善建材工業株式会社",""
"株式会社奥村設備",""
"株式会社国友トータルサービス",""
"金城開発株式会社",""
"株式会社辻コーポレーション",""
"株式会社ライトパス",""
"株式会社中島商事",""
"株式会社かねこ工務店",""
"株式会社安藤製材所",""
"株式会社真栄ハウジング",""
"有限会社オーミ交安施設",""
"山三設備株式会社",""
"吉川板金工業有限会社",""
"有限会社膳所",""
"株式会社滋賀コンストラクション",""
"株式会社ビルディング・コンサルタントワイズ",""
"株式会社ヤスダ",""
"株式会社七福建設",""
"有限会社彦根塗装",""
"株式会社オーエムテクノ",""
"株式会社岡村設計",""
"株式会社池口工務店",""
"京阪水工株式会社",""
"株式会社岡本工務店",""
"有限会社川島造園",""
"森本建設株式会社",""
"株式会社長谷川",""
"株式会社田中設備工業所",""
"グラッソ株式会社",""
"滋賀住宅販売株式会社",""
"株式会社イー・テック・ソリューションズ",""
"柿田鉄工所株式会社",""
"有限会社真栄",""
"株式会社明宝",""
"株式会社横田工房",""
"有限会社野田",""
"株式会社家庭電気サービス",""
"有限会社中村ホームガス",""
"有限会社広陽電機水道",""
"株式会社設計工房",""
"ファーストエンジニアリング株式会社",""
"株式会社ヒサキペンタップ",""
"有限会社川窪造園",""
"株式会社ファースト住宅サービス",""
"株式会社雁瀬工務店",""
"株式会社片岡保温工業所",""
"有限会社共友建装",""
"株式会社中野測量設計事務所",""
"有限会社伸和電器商会",""
"荒川建設株式会社",""
"有限会社ツジイチ",""
"株式会社黒田住建",""
"シガソーラーアメニティ株式会社",""
"コトブキ技建株式会社",""
"株式会社国領設備",""
"株式会社幸弘設備",""
"株式会社ATUM",""
"有限会社赤田工務店",""
"株式会社ハートフルワニ電化",""
"ジーテクノス株式会社",""
"株式会社ハウスオークション",""
"株式会社阪口",""
"ArimotoDesignWorks株式会社",""
"株式会社巴建設",""
"株式会社川北商店",""
"株式会社シノダ工務店",""
"株式会社エムケー",""
"株式会社内堀建築設計事務所",""
"株式会社タカシマ",""
"桐畑木材株式会社",""
"有限会社冨士装飾",""
"株式会社空",""
"ベストハウスネクスト株式会社",""
"株式会社シガキャドセンター",""
"株式会社裕進",""
"株式会社サンネスト",""
"北村工業株式会社",""
"株式会社川原林工務店",""
"株式会社クズハタ装飾",""
"株式会社L-planning",""
"株式会社大安工務店",""
"有限会社アトリエ・ウィズ",""
"株式会社トヨケン",""
"有限会社ほんだ建築",""
"有限会社中村庭園",""
"有限会社ウッディーアート",""
"なごみ住宅株式会社",""
"マルヤ工業株式会社",""
"株式会社創作舎",""
"株式会社ショウヨウ",""
"有限会社大弥工務店",""
"株式会社Y’s",""
"トーワ測量株式会社",""
"志賀設備工業株式会社",""
"有限会社ノリアキ工房",""
"有限会社岡部工務店",""
"有限会社荒木板金工業",""
"株式会社小寺美装",""
"ワボウ産業株式会社",""
"株式会社国土地建",""
"朝日店舗総業株式会社",""
"ゼルワーク株式会社",""
"YESAND合同会社",""
"有限会社サンシャイン住設社",""
"有限会社サンエネシステム",""
"株式会社大角工務店",""
"株式会社古川総建",""
"株式会社船浅",""
"株式会社安土建築工房",""
"有限会社田邊工務店",""
"有限会社デュークス",""
"株式会社兵助",""
"小出建設株式会社",""
"奥村管工株式会社",""
"東洋ボード株式会社",""
"株式会社岡春工務店",""
"昭栄産業株式会社",""
"株式会社建部",""
"有限会社疋田建設",""
"株式会社甲賀建材店",""
"株式会社ユニオン設備",""
"株式会社岩佐建築設計事務所",""
"株式会社中川工務店",""
"株式会社内田設備工業",""
"株式会社キクヤ",""
"株式会社江成建設",""
"轡製缶株式会社",""
"有限会社桃栗柿屋",""
"有限会社アサヒ工芸",""
"有限会社嘉平工務店",""
"有限会社ベター・ライフ",""
"有限会社ホーム・ランド",""
"有限会社裕花園",""
"株式会社ムラカミ",""
"株式会社山野興業",""
"有限会社ナカガワ電設",""
"有限会社エムテクノ",""
"株式会社重野緑地建設",""
"内海建設株式会社",""
"アヤハ賃貸サービス株式会社",""
"有限会社西山家具",""
"株式会社多賀組",""
"びわこ板倉の家株式会社",""
"株式会社林田工業所",""
"杉本工業株式会社",""
"甲陽興産株式会社",""
"株式会社プリンスホーム",""
"株式会社大旺政",""
"株式会社ジオプラン",""
"株式会社大橙社",""
"株式会社江州",""
"北出産業株式会社",""
"有限会社小池住研",""
"大久保建設株式会社",""
"株式会社澤工務店",""
"有限会社アラホリ住設",""
"株式会社ケイズコーポレーション",""
"株式会社勝森産業",""
"有限会社いそだ設備",""
"有限会社エナツ設備サービス",""
"有限会社山亀工務店",""
"株式会社井之商",""
"有限会社オーナメントサービス",""
"福井電気工業株式会社",""
"株式会社あぷろす",""
"ファーストレイク株式会社",""
"株式会社西村建具",""
"株式会社ラサハウジング",""
"有限会社桧住建",""
"未来住宅株式会社",""
"オオツホーム有限会社",""
"株式会社創心",""
"有限会社タイルド工房",""
"有限会社杉江建築事務所",""
"山中電工株式会社",""
"株式会社北村左官工業",""
"滋賀技建株式会社",""
"有限会社コカドコンストラクション",""
"株式会社メイコウ",""
"株式会社山本塗装防水",""
"有限会社西條建設エクステリア",""
"株式会社横山塗装店",""
"株式会社富田建設",""
"株式会社遊工房",""
"さかい株式会社",""
"株式会社アールピーハウジング",""
"有限会社よしかわでんき",""
"神田材栄有限会社",""
"株式会社白畑建設",""
"有限会社一宮設備",""
"旭工務店株式会社",""
"株式会社梶長",""
"株式会社マツノ",""
"株式会社北村セメント店",""
"有限会社野々村瓦店",""
"有限会社リビングメイクヤノ",""
"有限会社安賀瓦店",""
"株式会社松田組",""
"株式会社かんき建設",""
"株式会社中川ガラス",""
"滋賀日商プロパン株式会社",""
"株式会社湖都コーポレーション",""
"みやび建設株式会社",""
"有限会社タカテックコーポレーション",""
"株式会社トップシュート",""
"株式会社梅久",""
"有限会社柴田工務店",""
"有限会社山越林業",""
"株式会社プレシャスホーム",""
"有限会社タクマ産業",""
"大賀産業株式会社",""
"有限会社伊藤嘉商店",""
"株式会社湖西住建",""
"株式会社アビエルタ建築・都市",""
"西山産業株式会社",""
"湖南ルーフ株式会社",""
"株式会社アドニス",""
"中西造園株式会社",""
"有限会社杉本塗装",""
"有限会社近江しろあり",""
"株式会社ワンズスペース",""
"植田硝子工業株式会社",""
"株式会社青和住建",""
"有限会社アイボックス",""
"株式会社bizen",""
"株式会社リビック長浜",""
"株式会社草渓建設",""
"有限会社南エンジニアリング",""
"有限会社真和設備",""
"有限会社八厚浄化センター",""
"株式会社フジ工務",""
"株式会社大喜工務店",""
"株式会社北中工務店",""
"ハピネスホーム株式会社",""
"株式会社込山建築設計事務所",""
"大信建設株式会社",""
"株式会社ほり",""
"株式会社マルイビルド",""
"菱和ホーム株式会社",""
"株式会社タニケン設計",""
"有限会社大彦",""
"株式会社高阪鈑金工業",""
"有限会社リフォーム石倉",""
"株式会社エフォート",""
"赤井住宅設備株式会社",""
"株式会社北井工務店",""
"株式会社マツテック",""
"石本工業株式会社",""
"株式会社NIKE",""
"村木電気水道工業株式会社",""
"有限会社塚又商店",""
"株式会社藤田電気工業",""
"有限会社荒木テクニカル",""
"有限会社もくば工房",""
"株式会社大津建材センター",""
"株式会社楓住建",""
"アールエスティ住宅流通有限会社",""
"株式会社タイズ",""
"株式会社ニシケン",""
"株式会社大覚",""
"秀熊電建工業株式会社",""
"有限会社乾産業",""
"株式会社コトウ",""
"株式会社綜合設計アトリエ",""
"株式会社広輝興業",""
"かじ藤硝子株式会社",""
"株式会社東和ハウザス",""
"株式会社丸山建築事務所",""
"株式会社高谷",""
"株式会社第一技研",""
"株式会社ASTEP",""
