"Name","Website"
"Heart-s.co",""
"さくらホームグループ株式会社",""
"ハウジング・ジャパン株式会社",""
"中尾建設工業株式会社(ナカオホーム)",""
"株式会社リロケーション・ジャパン",""
"チルホーム株式会社",""
"髙松テクノサービス株式会社",""
"有限会社汗青社",""
"野村不動産株式会社",""
"ANAスカイビルサービス株式会社",""
"47内装株式会社",""
"FUJITA CORPORATION",""
"Fesheries Engineering",""
"CWBAKU inc.",""
"BWコンサルティング株式会社",""
"Kraft Architects",""
"Jamo associates Co.,Ltd.",""
"DesignStudio12",""
"GIFT",""
"KaCH",""
"MACオフィス",""
"ORSO",""
"MBM",""
"Rocaデザイン事務所",""
"RRRLab株式会社",""
"QGRAPHDESIGN・GUAW",""
"NEW SKOOL",""
"RISE-BUILD株式会社",""
"SHOWA GROUP 株式会社",""
"SIOALITTLE.design",""
"SK-HOME",""
"Skyland Ventures",""
"SPACEHEAD株式会社",""
"Stucco co.,Ltd",""
"SNデザイン",""
"UDA建築設計",""
"Tinkpersecond株式会社",""
"cips",""
"YS Real Estate Leasing株式会社",""
"kanae.建築空間設計事務所",""
"eSmy-home株式会社",""
"VADO Design Office株式会社",""
"株式会社前田工務店",""
"sawan株式会社",""
"takarabune",""
"株式会社鷲澤建設",""
"アイデジタルツイン",""
"さくら工房株式会社",""
"わさび設計。",""
"アイビー設計",""
"アイラボ一級建築士事務所",""
"イトウ建築計画",""
"インフィニティ株式会社",""
"アトリエキット",""
"株式会社イトーキ",""
"アグレ都市デザイン株式会社",""
"ウツミ工務店",""
"オリエンタルコンサルタンツグローバル",""
"エルアングル",""
"クレア工業株式会社住宅事業部",""
"カズプランニング",""
"グッドルーム株式会社",""
"カルチュア・コンビニエンス・クラブ",""
"株式会社オンデザインパートナーズ",""
"コイズミファニテック株",""
"コクヨ 株式会社",""
"コクーン設計舎",""
"ダイヤオフィスシステム株式会社",""
"サロウィン株式会社",""
"デザイナーズスタジオ株式会社",""
"スペースラボ",""
"トパス株式会社",""
"ノムラメディアス",""
"トヨタホーム株式会社",""
"ヒョンジ",""
"ハウフルス",""
"フリーダム株式会社",""
"プラス株式会社",""
"プロパゲート近江株式会社",""
"プリズム",""
"ホームステージング TOKIO",""
"プラス株式会社ファニチャーカンパニー",""
"マイナス思考の建築",""
"マナトレーディング株式会社",""
"ユニオンテック株式会社",""
"リーズ不動産株式会社",""
"ルネサンス",""
"リフォームワン株式会社",""
"レディアホーム株式会社",""
"不動産の岩原",""
"不動産SHOPナカジツ",""
"株式会社乃村工藝社",""
"中央工学校",""
"中山設計",""
"中尾建設工業株式会社",""
"五洋建設株式会社",""
"創和防音",""
"中央工機株式会社",""
"伊藤喜商事株式会社",""
"創造系不動産",""
"博樹",""
"加和太建設",""
"原宿不動産",""
"合同会社カンガルーアセットマネジメント",""
"合同会社曉",""
"合同会社あんず",""
"合同会社 innovate works",""
"吉野設計",""
"国際航業株式会社",""
"吉村紳 一級建築士事務所",""
"大塚高史建築設計事務所",""
"壷山Design",""
"大和住研株式会社",""
"大岡産業株式会社",""
"株式会社安井建築設計事務所",""
"小原建設株式会社",""
"小倉建設株式会社",""
"小林工業株式会社",""
"建築計画工房",""
"小川工業株式会社",""
"新潟県庁",""
"建築設計アトリエハイジ",""
"日建フレメックス株式会社",""
"学校法人日本大学",""
"日本ホーミング株式会社",""
"旭化成リフォーム株式会社",""
"日鉄エンジニアリング株式会社",""
"有限会社Vapor Trail",""
"有限会社イッセイホーム",""
"有限会社エム・プロダクツ",""
"有限会社スズタカ",""
"有限会社トータル・プランニング・シ-",""
"有限会社ランドスケーププロダクツ",""
"有限会社市場印刷",""
"東京ハートス",""
"有限会社泉建装",""
"有限会社船田アーキテクツ",""
"東急不動産株式会社",""
"株式会社ALA",""
"柳沢デザイン",""
"株式会社BIGLONG",""
"株式会社AN-Design&WRiting",""
"株式会社Blume Cosmetics",""
"株式会社BLISS",""
"株式会社BRIGHT LIFE",""
"株式会社GOOD PLACE",""
"株式会社HOTCIA",""
"株式会社GAF CREATE",""
"株式会社Plan・Do・See",""
"株式会社Rstock",""
"株式会社KT",""
"株式会社ReBeaut",""
"株式会社Sogu",""
"株式会社Sponge",""
"株式会社mast一級建築士事務所",""
"株式会社daishizen",""
"株式会社TRIAD",""
"株式会社bound-design",""
"株式会社Tomovations",""
"株式会社yamada",""
"株式会社あいず",""
"株式会社wool design room",""
"株式会社うんの",""
"株式会社まつもとコーポレーション",""
"株式会社ようび",""
"株式会社アッカ",""
"株式会社うみそらみどりとまち",""
"株式会社 イシカワ",""
"株式会社アートフリーク",""
"株式会社オフィスオフサイド",""
"株式会社エース事務機",""
"株式会社オーディン",""
"株式会社 エー・アール・ジー",""
"株式会社オーパス",""
"株式会社オープンハウス・ディベロップメント",""
"株式会社オープン・エー",""
"株式会社クラフト",""
"株式会社サンライフホームサービス",""
"株式会社オーヴァル",""
"株式会社サンゲツ",""
"株式会社クレアール",""
"株式会社シアーズホームバース",""
"株式会社タイムレス",""
"株式会社ジョンソンホームズ",""
"株式会社シロ建",""
"株式会社スパーク",""
"株式会社スカイフィールドコーポレーション",""
"株式会社タカショー",""
"株式会社ドンホールディングス",""
"株式会社ノムラアークス",""
"株式会社ネオプラ",""
"株式会社ナラムラ",""
"株式会社ハラショー",""
"株式会社ヒカリ",""
"株式会社バンブーフィールド",""
"株式会社ハク",""
"株式会社フジヤ",""
"株式会社フォルム建築計画研究所",""
"株式会社ブリッジ",""
"株式会社ベイカレントコンサルティング",""
"株式会社ポリライン",""
"株式会社マスターズ",""
"株式会社ユタカワン",""
"株式会社ライフアドバンス",""
"株式会社リアルエステートブラザーズ",""
"株式会社リノシスコーポレーション一級建築士事務所",""
"株式会社リノベース",""
"株式会社ワールドエリアネットワークス",""
"株式会社 久保建築設計",""
"株式会社住ま居る",""
"株式会社久家設計事務所",""
"株式会社ワコール",""
"株式会社亀太",""
"株式会社凡美社",""
"株式会社創実エージェンシー",""
"株式会社創宣クリエイティブ",""
"株式会社双葉デザイン",""
"株式会社 変わり紋",""
"株式会社和光リフォームサービス",""
"株式会社大伸社ディライト",""
"株式会社市浦ハウジング&プランニング",""
"株式会社 建研 大阪支店",""
"株式会社大樹",""
"株式会社杉本組",""
"株式会社 愛和",""
"株式会社新昭和リビンズ",""
"株式会社日本創建",""
"株式会社日建設計",""
"株式会社 横尾材木店",""
"株式会社濱田建築事務所",""
"株式会社横松建築設計事務所",""
"株式会社礎",""
"株式会社 美都住販",""
"株式会社経営企画室",""
"株式会社片桐建設",""
"株式会社西尾建築設計",""
"株式会社野崎製作所",""
"株式会社誠一建設",""
"株式会社 錢高組",""
"株式会社風景屋",""
"株式会社門倉組",""
"株式会社 鈴木建築設計事務所",""
"株式会社電通ライブ",""
"株式会社高橋レジデンス",""
"株式会社香瑛住研",""
"森ビル株式会社",""
"株式会社JUST DO IT",""
"株式会社鴻池組",""
"株式会社S・PRIT",""
"楽天ステイ株式会社",""
"池田俊彦建築設計事務所",""
"永田不動産株式会社",""
"稲垣建築事務所",""
"河合建築工房",""
"石井建築事務所",""
"環建築工房",""
"西川建築設計",""
"鈴与建設株式会社",""
"鈴木建築設計室",""
"関西大学",""
"間建築計画",""
"高松商工会議所",""
"KAWASAKI建築設計",""
"高松テクノサービス株式会社",""
"H・K+一級建築士事務所",""
"BRAVAL",""
"HILLS",""
"LYTech株式会社",""
"JNIプロパティーズ株式会社",""
"くらがの不動産・株式会社クレセール",""
"Life Design Works",""
"SaikyoHome株式会社",""
"ぶどう不動産",""
"わくわく不動産株式会社",""
"アムス・インターナショナル株式会社",""
"アートホーム設計工務",""
"アーキ不動産株式会社",""
"エムイーPLUS埼京株式会社",""
"エークリエイト株式会社",""
"グラングッド不動産株式会社",""
"コムホーム株式会社",""
"セイズ株式会社",""
"テラスエステート",""
"スマイル不動産福岡",""
"タクエーホーム株式会社",""
"タン・コンサルティング株式会社",""
"ドアーズ株式会社",""
"ハンズホーム株式会社",""
"株式会社ドリームホーム",""
"パシフィック不動産株式会社",""
"バウハウスデザイン",""
"プロニーズ",""
"ブーストマーケティング株式会社",""
"ビッグビレッジ合同会社",""
"マァズエイム株式会社",""
"ミライノカタチ",""
"ミライアス株式会社",""
"メルシー株式会社",""
"ライフトラスト津田沼",""
"ライフサービスグループ株式会社",""
"ムタはうす株式会社",""
"ヨコハマ地所株式会社",""
"リクロス株式会社",""
"ライフベイシス株式会社",""
"合同会社CelesteBlue",""
"冨士イズム株式会社",""
"千葉リアルティー株式会社",""
"国立不動産有限会社",""
"大化地所株式会社",""
"安心計画株式会社",""
"新日本住建販売株式会社",""
"日動建設株式会社",""
"有限会社シェルージュ",""
"有限会社山陽不動産",""
"有限会社ホームライフサポート",""
"有限会社立石設計",""
"東宝ハウス船橋",""
"東京大家塾合同会社",""
"株式会社GA technologies",""
"株式会社Eastone",""
"株式会社KAKUSHIN",""
"株式会社K.clan",""
"株式会社NORTHCOMPANY",""
"株式会社MKエステート",""
"株式会社MyHomeDo",""
"株式会社PLEAST",""
"株式会社Relic",""
"株式会社SEEC",""
"株式会社SUMiTAS",""
"株式会社Shake",""
"株式会社aina",""
"株式会社Sunsハウジング",""
"株式会社i-Plain",""
"株式会社セカンドエム",""
"株式会社プライムハウス",""
"株式会社すまらいふ",""
"株式会社おうち広場",""
"株式会社いえらぶGROUP",""
"株式会社樹・夢工房",""
"株式会社くみん不動産",""
"株式会社みんなの家",""
"株式会社たきのぼり不動産",""
"株式会社イーカム",""
"株式会社アイクリック",""
"株式会社アヤメ企画",""
"株式会社エフプラン",""
"株式会社アイビス",""
"株式会社イーグランド",""
"株式会社エージェント",""
"株式会社イー・ステート・オンライン",""
"株式会社エフズコーポレーション",""
"株式会社クレセール",""
"株式会社クリアジャパン",""
"株式会社クラウドマーケット",""
"株式会社サンタ不動産",""
"株式会社グランディール",""
"株式会社コウナン・レクセル",""
"株式会社サンプラン",""
"株式会社サンデイホームズ",""
"株式会社シップス",""
"株式会社スタイルポート",""
"株式会社スペース",""
"株式会社ティーエスプロパティ",""
"株式会社トップインターナショナル",""
"株式会社ノーブルホーム丸和住宅事業部",""
"株式会社トライフォート",""
"株式会社ドミール",""
"株式会社ハウスプラザ",""
"株式会社ハローホーム",""
"株式会社ハウスマーケット",""
"株式会社ブランカ(インテリア不動産)",""
"株式会社ヒノキヤグループ",""
"株式会社ブリスライフ",""
"株式会社フジケンハウジング",""
"株式会社プラットホーム",""
"株式会社ベイシス",""
"株式会社プレジオ",""
"株式会社ヤマユウ",""
"株式会社マルヨシ",""
"株式会社マークス",""
"株式会社ホスピタリティトラスト",""
"株式会社ライフスタイルイノベーション",""
"株式会社世田谷リアルエステート",""
"株式会社ライフスタイルカンパニー",""
"株式会社ライフラインサービス",""
"株式会社九電不動産",""
"株式会社リノクレスト",""
"株式会社北海道住宅通信社",""
"株式会社博進",""
"株式会社吉田システム",""
"株式会社大木工務店",""
"株式会社向上計画総合研究所",""
"株式会社明和不動産",""
"株式会社渚工務店",""
"株式会社穂積住宅",""
"株式会社船井総合研究所",""
"株式会社西武開発",""
"株式会社鳴門広告社",""
"株式会社香川不動産買取センター",""
"熊本地所株式会社",""
"河井林産株式会社",""
"西和不動産株式会社",""
"Dominating Keywords",""
"Vermilionwrld",""
"ナカオホーム",""
"Hermi",""
"Nani Dondakayala",""
"Munna Hussain",""
"株式会社エス・ジェイ",""
"河井林産株式会社岡山支店",""
"Amerigo Films",""
"タクエーホーム株式会社本店",""
"株式会社吉野建築設計事務所",""
"西日本旅客鉄道株式会社 金沢支社 金沢建築区",""
"琉球大学",""
"Yma",""
"kakubun",""
"個人事業主",""
"DesignArc",""
"ark.art",""
"コイズミファニテック株式会社",""
"会社員",""
"芝浦工業大学",""
"jenwu.co",""
"東京工業大学",""
"東京科学大学",""
"free",""
"soshi",""
"發的",""
"クレア工業株式会社",""
"前田建設株式会社",""
"サムティアセットマネジメント株式会社",""
"株式会社現代建築研究所",""
"株式会社三福管理センター",""
"株式会社ケイミックス",""
"VILLAX株式会社",""
"みずほ銀行",""
"株式会社パワーコンサルティングネットワークス",""
"美和ロック株式会社",""
"サーパス茅ヶ崎駅前",""
"千葉テレビ放送株式会社",""
"パナソニック株式会社",""
"合同会社西関土地",""
"株式会社リクモ",""
"株式会社TOKIUM",""
"オープンレジデンシア小石川",""
"COSOJI株式会社",""
"スターツアメニティー株式会社",""
"TOPPAN株式会社",""
"株式会社クラッチワークス",""
"三井住友海上火災保険 株式会社",""
"株式会社アイドマ・ホールディングス",""
"株式会社ファイン",""
"株式会社東急コミュニティー",""
"株式会社サン・ブレーン",""
"サムティプロパティマネジメント株式会社",""
"株式会社HYS",""
"株式会社東京トラスト",""
"株式会社仕上舎",""
"パナソニック株式会社 エレクトリックワークス社",""
"株式会社太平エンジニアリング",""
"TRCプロダクツ",""
"ロイヤルハウス株式会社",""
"株式会社いえらぶコミュニケーションズ",""
"株式会社ファーストプロ/菊名KSマンション",""
"大英産業株式会社",""
"アジア技術交流協同組合",""
"株式会社CDエナジーダイレクト",""
"株式会社をアシスポートCADセンター",""
"株式会社CISレジデンス",""
"マンション維持管理推進機構",""
"株式会社ライフポート西洋",""
"ナインアウト株式会社",""
"三井不動産レジデンシャルリース株式会社",""
"株式会社Fujitaka",""
"パーソル",""
"株式会社Wings",""
"野原グループ株式会社",""
"株式会社ストーンズ",""
"株式会社LIXILリアルティ",""
"株式会社JR東日本商事",""
"新電元工業株式会社",""
"有限会社 パークホームズハウジング",""
"東京大学",""
"株式会社ビーロット",""
"株式会社プライムクロス",""
"ハイロジック",""
"大成建設株式会社",""
"静鉄プロパティマネジメント株式会社",""
"株式会社一条工務店",""
"東リ株式会社",""
"パナソニックホームズ不動産株式会社",""
"株式会社レーベントラスト",""
"株式会社中目黒ジーティー",""
"SMK株式会社",""
"アットホーム株式会社",""
"株式会社ダイヤ財創",""
"株式会社インテリックスプロパティ",""
"メットライフ生命保険株式会社",""
"リフォームショップ株式会社",""
"五頭産業株式会社",""
"日建ベクトル株式会社",""
"日本アクセス株式会社",""
"なし",""
"公益財団法人江東区文化コミュニティ財団",""
"無職",""
"MHIエアロテクノロジーズ株式会社",""
"一般社団法人プロパンガス料金消費者協会",""
"株式会社DYM",""
"ミサホーム株式会社",""
"大和ライフネクスト株式会社",""
"合同会社美冠堂",""
"株式会社サンケイビルマネジメント",""
"ダイアパレスグランデージ大倉山",""
"日本メディカルファンド株式会社",""
"株式会社フロンティアハウス",""
"ベルエステート株式会社",""
"株式会社イングス",""
"実践経営ネットワーク株式会社",""
"株式会社フラワーサウンド",""
"ウルクル株式会社",""
"柏 木工 株式会社",""
"株式会社クリーク",""
"喜田建材",""
"株式会社ESTATE SYSTEM",""
"株式会社ゼンリン東海",""
"株式会社 エパック",""
"株式会社宅建ファミリー共済",""
"ホームエクスプレス構造設計株式会社",""
"株式会社CRI・ミドルウェア",""
"株式会社菊池襖紙工場",""
"アサヒグローバルホーム株式会社",""
"東京海上日動火災保険株式会社",""
"株式会社エコノ・テレステーション",""
"株式会社メイアイクリエイト",""
"大日本印刷株式会社",""
"埼玉県住宅供給公社",""
"株式会社SOARビジネスパートナー",""
"三菱地所 株式会社",""
"ラグナロク株式会社",""
"株式会社ランドネット",""
"旭化成不動産レジデンス株式会社",""
"東洋エステートサービス株式会社",""
"伊藤忠ケーブルシステム株式会社",""
"株式会社 コダマホーム",""
"株式会社Modern Leasing",""
"株式会社ブルズ",""
"有限会社渋谷パールホーム",""
"株式会社 グランドホーム",""
"マルキ建材株式会社",""
"大和屋株式会社",""
"鋼鈑商事株式会社",""
"マックス株式会社",""
"スマイルホーム株式会社",""
"株式会社 ハウスドゥ住宅販売",""
"株式会社松田平田設計横浜事務所",""
"株式会社アップル東京",""
"合同会社SAMURAI",""
"株式会社ビズリンク・コンサルティング",""
"三井住友建設株式会社",""
"Kivana株式会社",""
"キクカワエンタープライズ",""
"ANAファシリティーズ 株式会社",""
"パール商事株式会社",""
"東芝情報システム株式会社",""
"株式会社スマートハウジング",""
"ピュアグロース株式会社",""
"株式会社Kaboot",""
"大林新星和不動産株式会社",""
"株式会社アステックペイント",""
"ハートマンカン事務所",""
"三井住友ファイナンス&リース株式会社",""
"旭化成ホームズ式会社",""
"株式会社エクセル・コミュニティー",""
"株式会社ニトリ",""
"株式会社田中組",""
"有限会社アース・デザイン",""
"株式会社不動産動画制作",""
"株式会社ライナフ",""
"ヤマト電機株式会社",""
"tecture株式会社",""
"株式会社コンフィデンス・インターワークス",""
"フィグニー株式会社",""
"Kojin",""
"シティハウス文京本駒込",""
"菊川工業株式会社",""
"エムエスアイコンピュータージャパン株式会社",""
"伊藤忠リート・マネジメント株式会社",""
"株式会社ITP",""
"グッドモーニング・コミュニケーション株式会社",""
"株式会社マスコミ文化協会",""
"キヤノンシステムアンドサポート株式会社",""
"よろず企画",""
"株式会社コンピュータシステム研究所",""
"東武不動産 株式会社",""
"三菱地所レジデンス株式会社",""
"株式会社サクセス",""
"東京建物株式会社",""
"平安伸銅工業株式会社",""
"株式会社 建築設計同人あらき",""
"株式会社バイデンハウス",""
"ソニー生命保険株式会社",""
"株式会社サクセス・プロ",""
"Blueground Japan株式会社",""
"株式会社グレイスセブン",""
"株式会社グランドロータス",""
"株式会社ミヤタエンタープライズ",""
"株式会社サマンサ・ホームステージング",""
"株式会社sakukar",""
"大阪公立大学",""
"コンセプティエ・ジャパン合同会社",""
"積水化学工業株式会社",""
"株式会社Minobordo",""
"Techliberty株式会社",""
"合同会社インクアーキテクツ",""
"シャープ株式会社",""
"株式会社ギムアス",""
"株式会社吉野石膏DDセンター",""
"株式会社メルディア",""
"あき不動産管理株式会社",""
"株式会社シティハウス管理",""
"株式会社アクア",""
"生和不動産保証株式会社",""
"株式会社セブン&アイ・クリエイトリンク",""
"株式会社リクルート",""
"株式会社アルファドライブ",""
"スタートアドバンチャー",""
"因幡電機産業株式会社",""
"日本生命保険相互会社",""
"有限会社ブロシェット",""
"有限会社荒井産業",""
"ミツイワ株式会社",""
"石井邦明デザインスタジオ一級建築士事務所",""
"株式会社クレアスレント",""
"須山建設株式会社",""
"FUSOグループホールディングス株式会社",""
"大和ハウスリアルエステート株式会社",""
"羽賀社会保険労務士事務所",""
"ジャコワ株式会社",""
"株式会社B-team",""
"NTTデータ・カスタマサービス株式会社",""
"株式会社TERASS",""
"TC神鋼不動産株式会社",""
"株式会社 清和ビジネス",""
"株式会社アトム",""
"AUS",""
"ダイエーコンサルタンツ",""
"株式会社ネオキャリア",""
"株式会社スギヤマ",""
"永和不動産株式会社",""
"株式会社三福ホールディングス",""
"三菱地所ハウスネット株式会社",""
"有限会社アーバンエコロジー研究所",""
"ニューガイアエナジー株式会社",""
"株式会社カトルセ",""
"オフィスマーケティング研究所",""
"一般社団法人 全国古家再生推進協議会",""
"株式会社シーラ","http://www.m-york.com"
"高島株式会社",""
"オルテ地所開発株式会社",""
"株式会社クロダ","http:///sonyncc.co.jp/"
"株式会社コスモスイニシア","http://www.peandp.com"
"株式会社プロフェッショナル・ブレインバンク",""
"三菱電機株式会社",""
"株式会社共立エステート","http:///service.plainer.co.jp"
"株式会社 アクセルラボ",""
"株式会社コレカ・サポート",""
"コンチネンタルホーム株式会社",""
"有限会社華多岐",""
"株式会社ヤマコン",""
"西日本鉄道株式会社","http://www.adfaces.co.jp"
"NSK",""
"大津ヶ丘第五管理","http://www.kia-trust.com"
"三井住友海上火災株式会社",""
"株式会社レクシード","http:///homes.panasonic.com"
"株式会社東京建物アメニティサポート","http://www.applepa.co.jp"
"エッジテクノロジー株式会社",""
"株式会社タカサ","http://www.dear-life.co.jp"
"有限会社寺西商事",""
"宮川工機株式会社","http:///kairosjuutakuservice.com/"
"株式会社ビルネット",""
"株式会社KIZUKU",""
"株式会社S-point","http://www.builnet.co.jp"
"ソニーネットワークコミュニケーションズコネクト株式会社",""
"株式会社菅崎電気商会",""
"レジル株式会",""
"株式会社リブランマインド","http:///reyz.co.jp"
"株式会社クイックガーデニング","http://www.o-rm.co.jp/"
"株式会社ウィルオブコンストラクション","http://shintoshinf.co.jp"
"ケネディクス株式会社",""
"イチミヤ",""
"株式会社SIRE","http:///sonyncc.co.jp/"
"株式会社タカマツヤ",""
"株式会社AQ Group",""
"ソニーネットワークコミュニュケーションコネクト株式会社","http://addrec.co.jp"
"株式会社ゼンリン",""
"株式会社東芝","http:///ht-itc.jp"
"HARVEY RESIDENCE株式会社","http:///asobisystem.com"
"Privat",""
"株式会社あわえ",""
"株式会社ヤマシタジムキ",""
"カサヴェール河辺管理組合","http:///xtech.nikkei.com/"
"株式会社ジョリーグッド",""
"ホクシンハウス株式会社","http://www.azx.co.jp"
"FPTジャパンホールディングス株式会社",""
"株式会社レオパレス21",""
"株式会社0",""
"東武鉄道株式会社","http://www.nttdata.com/jp/ja/"
"株式会社池田山エステート",""
"有限会社天祥",""
"VNEXT JAPAN株式会社","http:///anastudio.co.jp/"
"株式会社日新ハウジング","http:///hennge.com/"
"株式会社インペリアル麻布",""
"株式会社LIXIL","http:///zforce.co.jp"
"株式会社クローバーコミュニティ",""
"株式会社divx",""
"キャリアネット株式会社","http://www.sankeibldg.co.jp/"
"株式会社サンケイビルマネジメント ビル事業本部","http:///speee.jp/"
"株式会社ケイオー","http:///nowhere.group/"
